<?xml version="1.0" encoding="UTF-8"?>
<xsd:schema xmlns:xsd="http://www.w3.org/2001/XMLSchema">
    <xsd:element name="continent">
        <xsd:complexType>
            <xsd:sequence>
                <xsd:element name="continentName" type="xsd:string"/>
                <xsd:element name="country" maxOccurs="12">
                    <xsd:complexType>
                        <xsd:sequence>
                            <xsd:element name="countryName" type="xsd:string"/>
                        </xsd:sequence>
                    </xsd:complexType>
                </xsd:element>
                <xsd:element name="countryLeader" maxOccurs="12">
                    <xsd:complexType>
                        <xsd:sequence>
                            <xsd:element name="countryLeaderName"/>
                            <xsd:element name="countryLeaderCountry"/>
                        </xsd:sequence>
                    </xsd:complexType>
                </xsd:element>
            </xsd:sequence>
        </xsd:complexType>
        <xsd:key name="oneCountry">
            <xsd:selector xpath="country"/>
            <xsd:field xpath="countryName"/>
        </xsd:key>
        <xsd:keyref name="countryRef" refer="oneCountry">
            <xsd:selector xpath="countryLeader"/>
            <xsd:field xpath="countryLeaderCountry"/>
        </xsd:keyref>
    </xsd:element>
</xsd:schema>